start	end	text
3438400	3443600	Okay, so DNS server that returns a particular record tells you.
3443600	3449840	Okay, here's the IP or here's the IP address for this host name.
3449840	3453360	You can cache this for whatever, 200 seconds.
3454480	3454720	Okay?
3455840	3459600	Or here's an IP address for something else and you can cache it for 10 seconds.
3459600	3462240	So it has a TTL field, every cache.
3465920	3469840	And so here it will say, it's just another example of a query.
3472160	3476960	It will tell you that here the TTL might be already there, right?
3476960	3477920	And ICS.
3477920	3481920	You might not need to go to the root, right?
3483360	3488320	And the reason is before, remember the previous example where we're looking at WWICSUCID?
3488720	3492640	Well, the local resolver, after that, having done that,
3493280	3495440	already knows that you don't need to go to the root.
3495440	3496880	You don't need to go to the ICSUCID.
3496880	3502480	You can just go to ICS-CCID that will resolve everything that ends with ICS-CCID.
3503680	3511040	So because we already resolved WWW, we can just resolve FTP ICS-CCID by going directly here.
3512720	3513040	Right?
3513040	3513920	Because we cached.
3514960	3517840	So this slide connects to one of the previous slides, right?
3518320	3520400	Where I showed how to resolve WWW.
3522960	3523600	All right.
3523600	3526720	So DNS by itself has no security.
3527680	3532880	It, how does it know, like, when a local resolver issues a query, right?
3532880	3538240	It says to the root review server, it says here, here's WWICSUCID.
3538240	3539680	You give me the idea, guys.
3539680	3543520	How does it know that the reply is to that query?
3543520	3546640	Because it might actually, the local resolver might issue many queries.
3546640	3555440	So, the way it's done, the sort of primitive authentication, there is a 16-bit transaction ID
3556320	3558720	that every query contains, okay?
3559600	3563600	So local resolver issues a query includes a 16-bit transaction ID.
3563600	3568080	When it comes back, it should have the same transaction ID that allows it to associate.
3569200	3570240	Request with reply.
3573840	3574400	Make sense?
3575360	3577120	Kind of a primitive authentication.
3577120	3584880	Now, it's obviously insecure, because if you have an adversary, it can do the following.
3585840	3590080	Again, this is like the classical example of DNS proofing.
3590080	3596560	So, I want you to consider an adversary that has a specific victim in mind.
3596560	3598800	Now, let's say him.
3600240	3602400	So, this guy's going to be the victim.
3602400	3603360	Yeah, you, sorry.
3606000	3606800	I know his name.
3606800	3608720	Let's say his name is Joe, right?
3609440	3610400	Joe is my victim.
3610800	3612400	I know Joe's email address.
3614560	3620320	I'm going to send him an, or maybe a phone phone, even better, a cell phone.
3622240	3624320	Either or, but cell phone is better.
3625280	3631920	I can send him either a text with a link, or an email with a link, right?
3633680	3638000	You know, I am the widow of the prince of Nigeria.
3638560	3643040	You know, I'm about to transfer you $5 million, but just send me your bank account,
3643040	3646320	and if you want details, I'm going to share my fortune with you.
3646960	3653600	So, basically, the idea is that he is to get him to click on a link.
3655120	3655760	Okay?
3655760	3662800	And the link will have some innocuous looking address, like host1 at foo.com,
3662800	3665760	where foo.com could be a totally benign domain, okay?
3665760	3672400	Benign, not necessarily adversarial domain, right?
3672400	3674080	It could be a bank, for example.
3675840	3676560	So, he clicks.
3676560	3681520	The clicking on that link will cause a DNS lookup, right?
3682640	3686160	Extract the name, the host name, the domain name, and do a DNS lookup.
3686160	3689520	So, that's him, Joe.
3690560	3690960	Client.
3692080	3694880	Whether he clicks on an SMS, a link, an SMS, right?
3694880	3698320	Or, iMessage, or WhatsApp, doesn't matter, right?
3698320	3699120	Or, an email.
3699120	3704000	But the interesting part here is that I know about the time that he does that.
3705120	3710560	That's why I say SMS is preferred, or text is preferred, because if I know he's a curious
3710560	3714240	George, he's going to like, I'm going to send him, and very quickly, he's going to click.
3714240	3718240	And, fishers know how to do this.
3720640	3728000	So, now what I do, as an adversary, I know that he's going to issue a DNS query to a local resolver,
3728000	3733920	so resolve host1 foo.com, right?
3734640	3743920	The local resolver says, oh, let me go to the name server for foo.com, okay?
3744240	3751120	There's some, I'm skipping the root and the .com, et cetera, right?
3751120	3752880	I'm just going to the root, to the last bit, et cetera.
3753600	3753920	Okay.
3755440	3758720	Now, at this point, or at that time, roughly that time,
3760400	3763680	the adversary makes a guess of their transaction ID.
3765040	3768400	Remember, each DNS query has a transaction ID, 16 bits.
3769200	3771520	2 to the 16, not a small number, right?
3771520	3775760	How big is this, 32,000?
3777680	3778400	Something like that.
3780080	3785680	So, your probability of guessing the correct transaction ID is low, right?
3785680	3796240	So, what the adversary does, he doesn't know the transaction ID, because we're not assuming
3796240	3800960	the adversary is actually nearby and listening, right?
3800960	3803840	In this example, this is why this attack is interesting.
3803840	3805520	The adversary could be very far away.
3805520	3813280	Like, Joe would be working for a defense counter or a government agency before.
3814320	3815600	I'm not anywhere near him.
3816160	3819440	I cannot snoop on this.
3819440	3826560	If I snoop, I wouldn't need to guess, right?
3826560	3830160	But I don't snoop, which makes the attack more interesting.
3831200	3835760	So, what I do is I guess a transaction ID, and I generate a fake reply.
3837120	3838080	See that first one?
3838080	3839200	Guess transaction ID.
3839200	3840960	HostFood.com is at 6666.
3842400	3843120	Make another guess.
3844480	3844960	Okay?
3844960	3846400	Another transaction ID.
3846400	3848240	HostFood.com is at 6666.
3848960	3849200	Okay?
3850240	3855680	So, I can generate a very large number of these kind of guessed transaction ID replies.
3857680	3858640	Not infinite, right?
3858640	3860640	I mean, I cannot generate maybe 32,000.
3860640	3866240	Maybe I can generate a couple of hundred in close proximity and send them to the victim, to Joe.
3868800	3869120	Bam.
3871120	3881360	Now, eventually, this DNS server will reply with a correct IP address for Foo.com, as it's supposed to.
3881360	3882640	This is not malicious.
3884240	3887920	This is a good reply, appropriate for that query.
3887920	3891520	But do you see what the problem happens?
3892560	3902320	If the adversary, in one of these guesses, guesses correctly, and beats the reply from the actual DNS server,
3903200	3904160	he wins the game.
3905840	3908000	Very important that you see that.
3910160	3910480	Do you?
3911200	3912000	Not ask.
3912000	3918800	All the adversary needs to do.
3918800	3921520	Now, I know, the bar is high, but the adversary needs to do this.
3922080	3925920	Guess the correct, so the transaction ID guessed by the adversary must match this.
3928480	3934240	And the, one of the red replies from the adversary, right, must come before this one.
3935200	3936560	Before the legitimate reply.
3937840	3939200	It's a probabilistic game.
3941040	3941440	Okay?
3941440	3942640	The adversary may lose.
3943760	3944240	There is.
3945520	3949040	But if he wins one of a hundred, the rewards are interesting.
3949040	3957440	He can try to guess as fast as possible.
3957440	3959120	He can pre-compute the guesses, right?
3959760	3960880	He doesn't need to, right?
3960880	3963760	He just, like, can pre-compute random replies, right?
3963760	3965600	And send them all at the same time.
3965600	3966720	Or roughly at the same time.
3966720	3968000	Bam, bam, bam, bam, bam.
3968000	3969200	As fast as possible.
3969200	3973120	Now, he doesn't know exactly when the client generates this query.
3973120	3975280	But he can guess, right?
3976000	3978880	Like, I send him an SMS, and I know the kind of person he is.
3978880	3980640	Like, maybe I know something about you.
3980640	3982880	Like, I know you replied to SMS quickly, right?
3984080	3987280	I know you're going to click it for the next five seconds, right?
3987280	3987680	Like this.
3987680	3990160	So, in those five seconds, I start generating those replies.
3991680	3995440	You, if you don't expect those replies, you'll just throw them away.
3996480	3998320	Your laptop, your phone will just ignore them.
3998320	3999680	You, as a user, will not know.
3999680	4001680	Right?
4001680	4008800	Because whenever unsolicited DNS replies arrive at your computer or your phone,
4008800	4010080	you, as a user, are not notified.
4010080	4010880	They're just thrown away.
4011760	4012960	Because nobody's expecting them.
4012960	4013680	So they're thrown out.
4014880	4018640	But if one of them comes back and matches the transaction ID, bam,
4019680	4023520	the real one will be ignored because it will arrive later.
4023520	4031360	So, if the attacker loses the game, he has to wait until the TTL, the time to live,
4031360	4034080	and this legitimate reply expires.
4034800	4036080	But the attacker is a patient.
4038480	4039360	You can try again.
4039360	4043600	HostFoo.com, Host3Foo.com, et cetera.
4043600	4045040	But why do that, right?
4046160	4046480	Right?
4047440	4049520	What's the point of hijacking that?
4049520	4053520	What's the point of getting somebody to click on HostFoo.com?
4054560	4055680	Or Foo.com at all?
4055680	4059520	And that is actually pretty easy.
4059520	4065840	So, the idea is that Foo.com could be a legitimate entity, like a bank or insurance company,
4065840	4067760	a university, or so on.
4067760	4072720	So, if you trick and succeed, right?
4072720	4080560	If you trick the client and actually guess the correct transaction ID, you can put a very long time to live.
4080560	4084960	Very long, maximum possible.
4085840	4095280	And now you know that whenever the client goes to anything, Foo.com, he's going to reuse the cash entry.
4097040	4097440	Aha.
4098720	4109600	So, now, the reply actually could be, I don't know where Host1Foo.com is, but I know the authoritative nameset report.
4111280	4113040	So, this is like raising the bar a little bit.
4113040	4123520	Instead of telling the, no, no, here's the host one, Foo.com, it says the authoritative nameserver lives at NS2Foo.com,
4124720	4126640	and its address is 6666.
4131440	4136000	Okay, so this is slightly different from what I showed in the previous slide.
4136000	4141280	The previous slide, what you saw is the tricking once, right, for one host.
4142080	4145440	Basically saying, oh, host1Foo.com lives at 6666.
4147360	4148720	This is a much broader scope.
4148720	4152880	This attack, which is very similar, but it's broader scope.
4152880	4159360	It says, if you guess the correct transaction ID, you can make sure that this client, from now on,
4159360	4166080	when it resolves anything, Foo.com, will go to adversarially controlled nameserver,
4166080	4168560	which is run by the adversarially.
4168560	4170560	Which is run by the adversarially there.
4170560	4179840	So now, if you win the race, this reply, legitimate reply, will be ignored, discarded.
4179840	4190960	And the attacker essentially will make sure that all subsequent, all future DNS requests for anything,
4191520	4194960	anything.foo.com, will go to 6666.
4196320	4201680	A malicious DNS server, fully controlled by the adversary, no need to win any future races.
4201680	4203760	Okay?
4204720	4206800	So much better investment of time for the adversary.
4208800	4209200	All right.
4211360	4214400	By the way, what can cause a DNS lookup?
4215360	4217520	Maybe you already know this, but just about anything.
4218240	4220320	A small ad in a webpage.
4221360	4221680	Okay?
4222480	4222880	Tiny.
4224000	4225280	You don't need JavaScript.
4225840	4230880	If JavaScript is enabled, it's easy, much easier, but you don't even need JavaScript.
4231680	4239600	But, like, a DNS hello, mail, oh, mail servers.
4239600	4244560	Mail servers are a pain in the ass, because, you know, if your mail servers will look up a lot of,
4244560	4246640	do a lot of DNS queries, right?
4248640	4250640	Telnet does a lot of DNS queries.
4250640	4253040	Spam checks do DNS queries.
4255040	4257600	Files, deliveries, all kinds of stuff.
4257600	4263360	So, triggering the DNS query is easy, but the best example I can think of is just sending him,
4263360	4267520	let's say, the victim a text message of some sort, right?
4267520	4272240	Because, and the nice thing about text messages is they're generally fast, right?
4272240	4277760	And users pay more attention somehow to them, especially in our more phone-centric culture.
4277760	4280960	Also, links are easier to hide, right?
4282000	4287120	Somehow, when you see something on a big screen, you might see something suspicious about the link,
4287120	4288960	or is it a text message is less like?
4290800	4292320	Okay, well, we're out of time.
4293600	4294480	See you next Tuesday.
4294480	4306640	Oh, because someone asked, if you are a PhD student who wants to include this course in the comprehensive exam,
4307760	4314720	in order not to have the exam, the actual exam, which is separate, you need to get an A to A plus, right?
4314720	4316320	So you get an A, at least an A in the course.
4317520	4319440	A plus is on the other thing.
4319440	4321520	But if you get an A in the course, you don't need to take the exam.
4324480	4327280	Let's remember the Karamel amp PP those who is per sorrichten.
4327280	4329280	Let's see you next time.
4329520	4333520	Bye.
4335040	4335200	Bye bye.
4337360	4338320	We had a great idea.
4339320	4340740	So these is a followup of the following plan.
4341680	4342320	Have a good time.
4345360	4346600	We're always having about a copy.
4346600	4348080	So we're not making an A a plus.
4349520	4351280	We're just walking the walk.
4351280	4354000	We hope we don't know how to add along.
