start	end	text
1893840	1896240	domain, and two transits in the middle. Yeah?
1896240	1901920	But that happens to average most of my requests. I'm not going to the North Pole. I'm going probably
1901920	1909200	somewhere within America. Okay, you are within the US. So you're going to
1911760	1913040	Google, right?
1915920	1917600	The route length is probably three.
1919840	1925440	That's my guess. But you can do a tracer route, and from tracer route, not always, but you can often
1925440	1932400	deduce how many AS hubs. Because tracer route might give you a reverse DNS lookup,
1932400	1938240	which might actually give you that, not this VIP address of what hubs your packets are taking,
1938240	1945040	but the actual host name. And so by the host name, you can tell the domain. And the domain often tells
1945040	1954960	you that that's a different AS. Does that make sense? So it has to be that at least three, maybe four,
1954960	1961920	you know? I mean, let's say you go to, I don't know, state of Florida government website, maybe it will
1961920	1969760	be four in that case, you know? Or some small department in the University of Lower East South Dakota
1969760	1974880	somewhere. Yeah. But that's my guess. But it has to be at least three.
1974880	1983440	So, I don't know if it's surprising, most people get surprised by this, that it's such a small number
1983440	1990880	of AS hubs. And 50% of the routes are less than four, and that's, tells you like that's the typical
1990880	1998480	thing, right? Source domain, source AS, one transit, and the destination. 95 of them are less than five,
1998480	2005440	five. Which means you really have to try hard to get, to hop through more than five domains.
2009200	2013920	And mind you, internet includes, I think it also includes like cellular, for example,
2013920	2021440	you're using your phone, right? And you don't have Wi-Fi access, or you're just not using Wi-Fi.
2021440	2027760	But you're still using IP, right? And so you do IP over cellular. So you're still kind of,
2027760	2029200	in fact, a part of the internet.
2033680	2034400	Alright, so,
2036880	2043760	a lot of problems in BGP, not just BGP, but other routing protocols, but BGP has been susceptible to it,
2043760	2048080	is something called black-holing. Black-holing is when a router
2048080	2061840	advertises routes that are too good. Right? And it's like, I have a distance one route to everyone.
2064000	2071360	Okay? And so, what happens? Like bees and honey, right? To use a more polite analogy,
2071360	2082000	everybody starts sending traffic to me. Okay? Which is problematic in two cases, right? First,
2082000	2088000	if this happens accidentally, I get swamped. Clearly, right? Because everybody says, oh,
2088000	2094720	forget all the other routes I have. This guy has route one distance to everybody. Must be amazing.
2094720	2101760	So everybody starts sending traffic to me. There's congestion near me. I get totally, you know,
2101760	2107440	strangled. Nobody can communicate to anybody, right? Because everybody's sending traffic to me
2107440	2114480	that I can't handle. Right? So, big problem. Black-holing, right? But it can also be done
2114480	2120000	maliciously. So it has happened accidentally. It has happened maliciously. When somebody says,
2120880	2127920	I don't like this company over here. This, I don't know, this whistleblower.com. I don't like them.
2129120	2133680	So I'm going to advertise a very low dislike. I'm one hop from whistleblower.com.
2134560	2138880	So essentially, she's like, send me their traffic. Send me their traffic. So I can just discard it.
2141200	2147920	Okay? This has happened as well. Back in prehistory, before you all were born, 97,
2147920	2153840	was already after the birth of the web. That was the day the internet died. I remember it.
2155920	2163920	This Florida ISP de-aggregated its BGP routing tables and basically re-agnetized it. It basically
2163920	2171760	said what I just described. It said, I'm neighbors with everybody. Bam! The internet just crawled
2171760	2179520	first like slow down like within seconds. Okay? So it has best route to everywhere on the internet.
2179520	2184960	And of course, it has to happen in Florida. Right? The most intellectual state in the nation.
2184960	2196000	Also, today, this is not the case, but the original BGP protocol or sort of the virgin BGP protocol,
2196000	2205120	the vanilla one, has no security. Again, designed for a friendly internet, right? So no authentication,
2205120	2212640	no integrity. Right? Today, it still doesn't, but there's something called BGP sec, which is the,
2212640	2218560	like IP sec for BGP basically, kind of like. And it establishes secure tunnels
2220560	2225280	between adjacent BGP routers. So it sends that updates over those secure tunnels.
2226560	2232960	Now, that prevents somebody from injecting packets, right? Or modifying packets between two adjacent
2232960	2239520	routers. But it does not prevent the malicious router from advertising, uh, from advertising valid,
2239520	2246000	uh, sort of, uh, malicious routes because, you know, it's, it's, it has a secure connection.
2246880	2252080	So this, this has happened a number of paths. So this is, uh, just for you to read.
2252080	2264400	This is back in 2003, I think. So YouTube has been around for a long time, right? YouTube actually
2264400	2272160	predates Google, even though Google owns it, uh, today. But, uh, so YouTube was popular already in
2272160	2280080	early 2000. So YouTube advertises, see, this is IP prefix. You know, everyone knows this notation,
2280080	2286720	you know, 22 bits, okay? Um, so it says here on YouTube, you know, and, uh, it's as an AS, right?
2286720	2290960	It's called, you see there it says AS three, three, six, five, six, one, three, six, five, six, one,
2290960	2296640	is the autonomous system ID assigned to YouTube. I think it's still in case today. Yeah.
2296640	2298960	What do you mean by YouTube for names?
2298960	2304320	Google. Well, I think YouTube was there. YouTube was a company.
2304320	2308720	I think it came, like, seven years later. Like 2005, it was YouTube.
2308720	2313920	Wait. 2008. Okay. Do a quick Wikipedia from here.
2313920	2317520	I did. And? Google was 98. YouTube was 2005.
2317520	2322320	Google was 98? Nobody heard of it until, like, 2003 or something.
2322320	2325040	Sure. But even then, YouTube stole them.
2325040	2327440	So it's later? Yeah, a little bit later.
2327440	2330080	But it wasn't part of Google. No, it wasn't right now.
2330080	2331440	Okay. So at least I got one thing right.
2333040	2340000	Okay. Uh, so there's your YouTube advertising to the rest of the of the world that here I am.
2340000	2343440	And here the Pakistani government decided that it doesn't like YouTube.
2343440	2349920	And so a Pakistani ISP, right, telecom, telecom, that is 7557,
2349920	2352720	advertising, see that 24?
2357440	2359280	Right? 2865 and 52.
2359840	2362240	So it basically says, I subsume.
2362480	2365440	This is a, this is, this is saying, I subsume YouTube.
2365440	2371520	So all worldwide YouTube traffic went to Pakistan.
2373280	2373920	For a little bit.
2374800	2376320	They had to manually intervene.
2377920	2379440	And it was a two hour outage.
2379440	2380320	People were incensed.
2380320	2384320	Valuable videos were not watched.
2388320	2391440	There were other incidents that one interesting one was the spammers.
2392400	2397920	So we have a, if we get to it, because we're moving very slow in this class, but steady.
2397920	2400080	If we get to it, there's a lecture on spam.
2400080	2407200	But, you know, spammers hijacked a bunch of, a bunch of, kind of a segment of IP prefixes,
2407200	2412240	allocated to Northrop Grumman, a company you might have heard of, defense company, very large,
2412240	2416000	located here in Southern California, among other places.
2416720	2424000	So it was an unused block of addresses that was allocated to Northrop Grumman since like 20 years
2424000	2426240	before that, okay?
2427120	2431120	They were, God knows what they were supposed to use it for, but it was allocated to them.
2431120	2434880	Now, a bunch of spammers hijacked that.
2436000	2438960	They just used those addresses to send spam.
2440960	2441920	But guess what happened?
2443280	2446880	I don't know if they intended it or not, but one, one important consequence is
2447520	2454880	that because of their, there were already anti-spam measures, the entire block wound up on the, on the, on the, on the, basically blacklist.
2456560	2456880	Okay?
2458400	2465280	So, took two months to actually manually reclaim ownership of those addresses and remove them from the blacklist.
2467120	2472160	Then there was this Malaysian ISP, also that hijacked the prefix of Yahoo.
2472160	2480640	Nobody knows if it was accidental or political, not sure what Malaysia has against Yahoo, I don't think, probably it was accidental.
2483040	2488800	This was more like, more likely to have been political, the Turkish ISP did this in 2004.
2489760	2493520	But similar thing to what the Pakistan ISP did in a previous slide.
2496160	2499280	This is a much more recent, this is only four years ago.
2499280	2502320	Maybe you remember, there was a Facebook outage.
2502320	2511920	And this was, this was accidental, but could have been malicious, but in this case, actually, no, Facebook, basically, itself, didn't do itself.
2511920	2516480	It withdrew routes of, of, of its prefixes from the DNS servers.
2517280	2520720	And basically, nobody could resolve Facebook addresses anymore.
2522400	2526000	Which means, what, like, it's not that Facebook couldn't be accessed.
2526800	2528160	Facebook was up and running.
2529120	2536320	But if you type facebook.com, the DNS would not be able to tell you the IP address.
2537680	2538000	Okay?
2538320	2542880	So if you had cached, and some people did this, I remember there was a discussion on the forums.
2543120	2551200	It's like, if you had actually cached the IP address of Facebook, that you could actually type the IP address in the URL, right?
2551200	2554640	You do know that you can actually substitute the domain name with the IP address.
2555520	2557680	In your, like, type it in, in your URL.
2558480	2559760	Well, if you did that, it would work.
2560320	2562480	But if you type in facebook.com, it wouldn't.
2562480	2566320	Because, basically, Facebook shot itself in the book.
2566320	2569360	But it happened, not because of DNS, it did happen because of BGP.
2571280	2571520	Right?
2571520	2578720	Because BGP, right, withdrew address prefixes for Facebook's DNS servers.
2578720	2585760	And when you resolve facebook.com, you can sell Facebook DNS servers.
2590640	2590960	Okay.
2592320	2592960	Switch over.
2593840	2594880	Domain name service.
2594880	2595680	Nice transition.
2597280	2598640	Designed by a guy from here.
2600400	2603120	Got a PhD around 82, 83.
2603120	2606240	In ICS.
2607840	2610000	And I met him a bunch of times.
2610000	2614800	In fact, I worked in the same organization that he, that he was for a few years.
2615680	2617360	So a guy's name is Paul Macapetrius.
2617360	2619200	He's kind of a serial entrepreneur these days.
2619200	2620960	Not much of a researcher or a scientist.
2620960	2628880	But back in the early 80s, he worked in a place up in Marina del Rey.
2629760	2631680	Called Information Sciences Institute.
2631680	2634000	Which is part of USC School of Engineering.
2634000	2636080	And basically like a research used to be.
2636080	2637440	Today it's just a development shop.
2637440	2639760	But back then it was a research think tank.
2640640	2641920	They did a lot of AI research.
2641920	2646320	They did a lot of like defense optics and electronics research.
2646320	2647520	And they did intern research.
2647520	2649920	So some of the like IP for example.
2649920	2652160	TCP IP were partly developed there.
2652960	2654880	At this USC ISI.
2655600	2660880	So this guy, Paul Macapetrius, he was a staff researcher there.
2660880	2664000	And he, people say he invented DNS.
2664000	2665600	There's no such thing as invented DNS.
2665600	2668320	DNS is a architecture.
2668320	2673360	What he did is that he realized that there was, the internet was growing.
2673360	2675440	Even already then, like in the early 80s.
2676160	2683520	And there needs to be a way to map the human readable host names.
2684160	2689520	Like foob.bar.com into IP addresses like 128, 195, 2.3.
2689520	2691040	Which nobody can remember.
2691040	2691840	Right?
2691840	2693040	Even back then it was a pain.
2693920	2696480	So he's the one that sort of realized it first.
2696480	2699680	And then came up with the first kind of cut implementation.
2699680	2701360	Of what we today call DNS.
2701360	2703440	Now DNS has evolved a lot.
2703440	2705360	It's not like IP.
2705360	2710320	IP kind of remained, IPv4 remained static since 1980 till what?
2710320	2712640	Early 40, 45 years.
2712640	2714160	But DNS evolved.
2714160	2716400	But the idea behind it is the same.
2716400	2719440	It's supposed to resolve, right?
2719440	2723200	IP domain names or host names.
2723200	2725280	And give you back IP addresses.
2725280	2729840	It's a hierarchical system.
2730800	2731120	Okay?
2731120	2733520	And without it the internet would grind to a halt.
2733520	2733760	Right?
2733760	2740400	In the domain name service today, the domain name system is as important as a routing protocol.
2740400	2740560	Right?
2740560	2742720	So without routing, the internet dies.
2742720	2744160	Without DNS, the internet dies.
2744160	2745760	Not right away necessarily, right?
2745760	2751520	Because if you cache some DNS addresses, you might not be able to.
2751520	2753200	You might be able to use the internet for a little bit.
2754240	2755280	So after a while, I'll be back.
2756240	2758880	And there are a bunch of these.
2758880	2759840	What's the root servers?
2762240	2766240	Anyway, so root servers are like the gods of DNS.
2766240	2770160	Like they know, they know stuff.
2773200	2774960	And they are replicated, right?
2774960	2781280	So they are replicated for fault tolerance and load distribution, load balancing, okay?
2782080	2782800	Around the world.
2783760	2788560	And they're not like, there's no like DI there.
2788560	2791360	They're not trying to be equitable, right?
2791360	2791920	Or fair.
2791920	2796880	The reason they are where they are is because of like heavy internet communication.
2797520	2800400	So they're not trying to say, oh, we should put one in Australia.
2800400	2801760	Because Australia is a continent.
2801760	2803360	We should put one in Africa.
2803360	2805920	We should put one in, I don't know, Siberia.
2805920	2806400	No.
2806400	2809440	The idea is, where is the like heaviest communication?
2810400	2811120	Right?
2811120	2818640	So it's not driven by so much geopolitical or fairness doctrine, but rather practical stuff.
2818640	2820240	But where is the traffic?
2820800	2821920	Most of the traffic, right?
2821920	2824800	So that's why you see nothing in South America.
2825920	2829760	South America, as far as the internet goes, is not a powerhouse.
2830960	2831600	Not a health.
2831600	2833280	I mean, people obviously use the internet here.
2833920	2836560	But not as heavily as other places.
2836560	2837520	Africa, nothing.
2838720	2839760	Australia, nothing.
2841360	2843680	This whole chunk of Asia, right?
2843680	2845520	Or Eurasia, nothing.
2845520	2846640	But there is something in Japan.
2848800	2849360	Okay?
2849360	2853200	And that one must have been more historic, because Japan was one of the first to adopt the internet.
2854160	2857440	Back in the 70s, or early 80s.
2857440	2863200	So we have nearby this USCISI, the Marine and Array, that has two root services.
2863200	2868480	One is actually operated by them, and then is operated by ICANN.
2868480	2871120	Internet something authority.
2871120	2879760	It's the organization, non-profit organization that manages essentially the gaming and all kinds of high-level issues for the internet.
2879760	2883840	And then here, Northern California is a bunch, and then on the East Coast.
2883840	2887360	Some of these are companies, Verisign and Cogent are companies.
2887360	2889200	Verisign has been bought, I think.
2889200	2892720	Then there is another very exciting.
2892720	2893200	Okay?
2893200	2899520	Then there is ARL Army Research Lab, US Department of Defense, University of Maryland, Grand One, etc.
2899520	2899840	Okay?
2899840	2900560	So you get to see.
2900560	2903360	Then London has, and then Stockholm has something.
2903360	2909680	So these are giant, I mean giant in terms of power, not in size, machines.
2909680	2913760	They get a lot of traffic.
2913760	2915680	They are super well connected.
2915680	2916400	Okay?
2916400	2922160	They have very high bandwidth wires, essentially, or lines connected to them.
2922160	2923120	Multiple ones.
2923120	2923360	Okay?
2923360	2926800	So they should be able to withstand a lot of traffic.
2928480	2929200	Simultaneously.
2930240	2930560	Okay?
2930560	2940320	And so there is this whole architecture for the root that I won't get into that essentially makes
2940320	2941040	them fault tolerant.
2941040	2945040	So there have been a number of attacks trying to take down, because if you take down the root service,
2945040	2946000	you bring down DNS.
2948160	2949600	But they're very hard to take down.
2951920	2954000	So what is the root, right?
2954000	2956240	So remember I showed you a bunch of them, right?
2956240	2958320	But every root is essentially the same.
2958320	2964480	There is a root DNS server that is responsible for what's called the dot domain.
2966320	2966800	The dot.
2968960	2972320	And then below the dot, you have the top level domains.
2973600	2987840	Like .com, .net, .org, .iju, etc., .tw for Taiwan, .jp for Japan, .au for Australia.
2987840	2990080	There are others, there are others like that, okay?
2990080	2991520	National level domains.
2991520	2993280	But these are top.
2994720	2997120	And then .com will be like here, right?
2997120	2998720	Google.com, etc., etc.
2998720	3002640	These are authoritative domains for like organizations.
3004640	3007360	WordPress, Wikipedia, Harvard, etc., right?
3007360	3009440	So UCI would be under HTML, of course.
3009440	3015600	And then, yeah, I'm not showing you all the levels that were the hierarchy, because obviously,
3016960	3019680	actually, UC.edu would be here.
3019680	3021360	Maybe UCI would be under UC.
3024560	3025360	Not sure about that.
3026320	3027040	Don't quote me.
3027040	3031520	How does a DNS actually work?
3031520	3037040	Well, when you type in a human readable post name, okay?
3037040	3044240	Whether it's facebook.com, google.com, you know, dailymail.com.uk, whatever the heck.
3044240	3052960	Whatever it is you type it in, you have in your device, not in your browser.
3052960	3053920	It's not part of your browser.
3053920	3055520	It's in your device.
3055520	3056960	You have the network configuration.
3056960	3058880	How many of you have to look at network configuration?
3060720	3061920	Oh, nobody's still curious?
3061920	3062640	They do.
3062640	3062880	Okay.
3063520	3069680	Well, you know, when you look in your Mac or your Windows machine, it will tell you like,
3069680	3071600	okay, here's your ID address, right?
3073520	3073760	Okay?
3074320	3075120	Here's your router.
3075920	3076480	It's all there.
3077520	3081200	It will also tell you, here's your DNS server.
3081200	3086080	It's usually configured, like, when you connect to the wireless, it's configured dynamically.
3086080	3087680	You can also configure it manually.
3088640	3092640	Like, you can put, I don't know, 8888, I think that's the Google DNS, right?
3093200	3097120	You can configure it manually or you can do it, you can just get it from the network,
3097120	3099280	from the local network that you are connected to.
3101040	3104480	Anyway, so this is your, what's called, local DNS recursive resolver.
3105360	3110560	This is the DNS agent essentially you go to for all your queries.
3111920	3112960	You don't go to the root.
3114720	3115280	Okay?
3115280	3118880	Because you don't know its address and even if you did, you wouldn't talk to it.
3119760	3124800	So you come to the DNS resolver and it says, oh, I want to resolve WWICS UCIEDU.
3125360	3126000	I don't know.
3127040	3128080	I don't know what that is.
3129520	3130160	Not always.
3130160	3132400	Sometimes it does already, if it's cached.
3132960	3135040	But it says, generally it says, I don't know what this is.
3135920	3136960	But let me ask the root.
3136960	3138240	The root is God.
3138240	3139520	So God should know.
3140240	3142720	So he goes, WWICS UCIEDU, can you tell me?
3142720	3146480	And he says, no, but I give you a nameserver record.
3146480	3147440	This is what NSD is.
3147440	3150960	So here's a record for UCIEDU, which I've heard of.
3150960	3153520	Okay?
3155520	3159840	Then, I'm a bit abstracting it here, because actually at the top there, there might be like
3159840	3163120	root and root will give you a pointer to EDU server.
3163120	3163600	Okay?
3163600	3165120	But then I'm abstracting it away.
3165120	3168720	Then it says, okay, here is a, and nameserver record to UCIEDU.
3168720	3174240	So you go here, you get this back, and then you quickly say, okay, now I can contact UCIEDU.
3174240	3178080	So I tell it, hey, I'm trying to resolve ICS UCIEDU.
3178080	3182480	And it returns to you the nameserver record.
3182480	3184000	It says, yeah, I'm UCIEDU.
3184000	3185760	I know about ICS UCIEDU.
3185760	3187360	Here is its address.
3188400	3193040	So you go here, and you say, I want to resolve WWICS UCIEDU.
3193040	3197280	And he says, oh, well, I do know WWS, the web server for ICS.
3197920	3201440	And it returns to you the actual IP address.
3201440	3208160	So this, as you see, is not an easy, like, ask a query, get back a reply.
3208720	3210400	It's a set of recursive queries.
3212560	3213360	How many?
3213360	3213840	Depends.
3215200	3216960	There are some hierarchies that are quite deep.
3216960	3220320	So it may go on for more than three handshakes like this.
3221200	3226480	That's why sometimes when you type, and the internet is not down, but you can see that there's a delay.
3227440	3227760	Right?
3227760	3228400	Have you seen that?
3229600	3232880	You're connected, the internet is working fine, but there's this delay.
3233680	3236160	And the delay is typically not because of your loading pages.
3236960	3252480	It's, I mean, it can be, but more often than not, the delays become DNS.
3256480	3258320	Okay.
3259120	3265920	Now, to reduce the load on DNS servers, which, as you can imagine, are very busy bees, right?
3265920	3266720	Because they're popular.
3266720	3269360	Everybody goes to the DNS servers.
3270160	3273760	So to reduce the load, the responses are cached.
3273760	3286720	So your local resolver here, this local DNS recursive resolver, will keep a cache of recent responses.
3288320	3288880	Okay?
3288880	3291920	How this cache is maintained depends on something called TTL, time to live.
3291920	3300080	It could be, it could be your ISP.
3301760	3306240	Because, like, when you go home, right, and you connect, I don't know if you, there's a wire,
3306240	3309440	wire also connecting in a dorm or, let's say you go to your parents' home, okay?
3310400	3312320	You have an, they have an ISP probably, right?
3312320	3314960	I mean, they're, they're buying internet from somebody, right?
3314960	3321120	And when you, when you open your laptop, the DNS resolver's name will be, will be in the configuration.
3321120	3321920	I usually there.
3322960	3325360	It is possible to run the DNS resolver locally.
3326400	3330160	You can run, install a DNS resolver on your local machine.
3331600	3334000	I don't recommend it necessarily, because you need to know what you're doing.
3334000	3334400	Yeah?
3334400	3334800	Yeah.
3334800	3343920	Because we can choose our DNS resolver by ourselves, can we choose the AS for the BGP routing path?
3343920	3344640	No.
3344640	3345440	No, you may not.
3346080	3349840	Because you don't route at the ASL, you don't run BGP.
3352960	3358480	The, if you are, let's say, customer of Cox.net, of Cox, internet, right?
3358480	3360560	Or AT&T, they pick it around.
3361840	3362560	Right?
3362560	3369760	Which AS, so you don't have, if they decide to send packets through North Korea, you have no control.
3371920	3373120	They have control.
3373120	3378320	They can say, I want to, I want to send packets through, I don't know, New Zealand instead of North Korea.
3378320	3381120	They can prefer one or the other, but you have no control.
3383120	3387760	Okay, so, as I said, the responses are cached.
3388560	3391280	And this is like sometimes, you know how you mistype something?
3392080	3396720	Mistype an address and it goes, name not, host not found or something.
3397280	3401840	And you keep clicking return and it just like, it doesn't, it very quickly does host not found, host not found.
3401840	3403200	Because it cached.
3404240	3408800	It doesn't want to bother the DNS server just to find out that host not found.
3410240	3411200	So that's one reason.
3411200	3414000	The other reason is if you are going to, you know, communicate to the same host.
3414000	3418160	Like if you're going to Facebook multiple times, it doesn't need to resolve it every single time.
3418800	3418880	Right?
3418880	3422480	You can just like, cache it in the local resolver and tell you.
3422480	3423920	It's faster that way.
3424800	3425120	All right.
3425120	3429440	So that's called negative queries, right?
3429440	3430320	They're cached.
3430880	3434160	Cached records are timed out periodically.
3434160	3438400	The time to live is subject to what the DNS tells you.
